,id,object_name,chain,object_type,address,number,street
3199,27284,принцесса,False,ресторан,"город москва, попов проезд, дом 2",200,попов проезд
3201,75004,кафе,False,кафе,"город москва, 1-я боевская улица, дом 6",44,1-я боевская улица
3220,27588,столовая школы 380,False,столовая,"город москва, 2-я улица бухвостова, дом 6",100,2-я улица бухвостова
3235,152444,imho bar,False,бар,"город москва, сретенский тупик, дом 5",50,сретенский тупик
3254,27389,школьная столовая № 1874,False,столовая,"город москва, улица маршала новикова, дом 13",170,улица маршала новикова
3256,27349,столовая гбоу школа № 1560 «лидер»,False,столовая,"город москва, новохорошевский проезд, дом 12",250,новохорошевский проезд
3276,152133,столовая института мировых цивилизаций,False,столовая,"город москва, 1-й басманный переулок, дом 3, строение 1",50,1-й басманный переулок
3289,126032,9bar,False,кафетерий,"город москва, стромынский переулок, дом 4",0,стромынский переулок
3296,25298,кафе «хомяк»,False,кафе,"город москва, заводской проезд, дом 25",35,заводской проезд
3301,28548,столовая при школе 1362,False,столовая,"город москва, лечебная улица, дом 20",80,лечебная улица
3320,28546,столовая при школе интернат № 53,False,столовая,"город москва, кирпичная улица, дом 18",150,кирпичная улица
3332,21274,сэлтинс,False,буфет,"город москва, стрелецкая улица, дом 2, строение 1",28,стрелецкая улица
3336,28839,гбоу школа №2200,False,столовая,"город москва, 11-я парковая улица, дом 50",112,11-я парковая улица
3338,29234,столовая при колледже,False,столовая,"город москва, 14-я парковая улица, дом 4б",100,14-я парковая улица
3345,21453,столовая школы 434,False,столовая,"город москва, улица благуша, дом 6",80,улица благуша
3349,27399,столовая при школе 1056,False,столовая,"город москва, штурвальная улица, дом 7, корпус 2",240,штурвальная улица
3350,20931,алеся,False,столовая,"город москва, минаевский переулок, дом 2",60,минаевский переулок
3359,146703,бабу,False,кафе,"город москва, щелковский проезд, дом 13",44,щелковский проезд
3360,22224,кафе «сочи»,False,кафе,"город москва, мажоров переулок, дом 5",15,мажоров переулок
3367,73308,кофе-хаус,True,кафе,"город москва, измайловская площадь, дом 1а",98,измайловская площадь
3371,27633,цо 345,False,столовая,"город москва, елоховский проезд, дом 1, строение 5",100,елоховский проезд
3375,21367,школа 1204,False,буфет,"город москва, рубцов переулок, дом 10/14",77,рубцов переулок
3380,21369,школа 1203,False,буфет,"город москва, кондрашевский тупик, дом 3а",30,кондрашевский тупик
3381,27855,мосводоканал,False,столовая,"город москва, плетешковский переулок, дом 2",90,плетешковский переулок
3388,29148,школа №87,False,столовая,"город москва, улица николаева, дом 5",40,улица николаева
3391,21035,малыш и карлсон,False,буфет,"город москва, триумфальная площадь, дом 2, строение 1",15,триумфальная площадь
3392,20642,сп «рольф»,False,бар,"город москва, 2-й магистральный тупик, дом 5а",25,2-й магистральный тупик
3465,21280,буфет медицинского училища при гкб им. боткина,False,буфет,"город москва, 2-й боткинский проезд, дом 5, корпус 28",40,2-й боткинский проезд
3527,21030,буфет,False,буфет,"город москва, мамоновский переулок, дом 10, строение 1",4,мамоновский переулок
3529,22576,золотой дракон,False,кафе,"город москва, дегтярный переулок, дом 6, строение 1",86,дегтярный переулок
3530,25096,ливанец,False,кафе,"город москва, глинищевский переулок, дом 3",98,глинищевский переулок
3597,26857,гарден,False,ресторан,"город москва, 3-я песчаная улица, дом 2",80,3-я песчаная улица
3619,154224,обломов,False,ресторан,"город москва, 1-й монетчиковский переулок, дом 5, строение 1",75,1-й монетчиковский переулок
3621,142570,квартира 44,True,кафе,"город москва, улица малая ордынка, дом 24",38,улица малая ордынка
3624,29577,школа 540 «кдп»,False,столовая,"город москва, хавская улица, дом 15",200,хавская улица
3630,129451,кафе «ванадис»,False,кафе,"город москва, жуков проезд, дом 8, строение 3",30,жуков проезд
3633,141361,ирландский паб белфаст,False,кафе,"город москва, средний овчинниковский переулок, дом 1, строение 13",40,средний овчинниковский переулок
3639,21582,школа 573 «кдп»,False,столовая,"город москва, 5-й рощинский проезд, дом 4",120,5-й рощинский проезд
3642,19883,солнечный очаг,False,ресторан,"город москва, улица богданова, дом 56б",60,улица богданова
3652,23673,школа 1000,False,столовая,"город москва, наро-фоминская улица, дом 1",130,наро-фоминская улица
3653,23662,школа 1009,False,столовая,"город москва, улица щорса, дом 5",200,улица щорса
3670,69444,mojo,False,кафе,"город москва, сверчков переулок, дом 8, строение 1",63,сверчков переулок
3701,156723,eleven-hall,False,ресторан,"город москва, малый каретный переулок, дом 11, строение 2",100,малый каретный переулок
3713,23514,осипов а.с. (прод.база «очаково»),False,столовая,"город москва, проектируемый проезд № 1980, дом 4",60,проектируемый проезд № 1980
3754,29173,моск. гор. колледж инф-х технологий,False,столовая,"город москва, костомаровская набережная, дом 29, строение 1",84,костомаровская набережная
3755,27019,гостиница лефортово,False,ресторан,"город москва, 1-й краснокурсантский проезд, дом 1/4",200,1-й краснокурсантский проезд
3756,27859,столовая при ммгп «мосгаз» буфет,False,столовая,"город москва, мрузовский переулок, дом 11, строение 1",30,мрузовский переулок
3760,152836,полковнику никто не пишет,False,кафе,"город москва, петроверигский переулок, дом 4, строение 1",44,петроверигский переулок
3763,21365,школа 1227,False,буфет,"город москва, большой трехсвятительский переулок, дом 4",55,большой трехсвятительский переулок
3765,21373,школа 330,False,буфет,"город москва, большой казенный переулок, дом 9",55,большой казенный переулок
3766,28859,лицей 1303,False,столовая,"город москва, таможенный проезд, дом 4",170,таможенный проезд
3768,28861,школа 1229,False,столовая,"город москва, верхний золоторожский переулок, дом 2",170,верхний золоторожский переулок
3775,28863,школа 416,False,столовая,"город москва, шепелюгинская улица, дом 21/13, строение 1",150,шепелюгинская улица
3776,28860,школа 733,False,столовая,"город москва, лонгиновская улица, дом 6",120,лонгиновская улица
3784,153726,столовая при фгбоу во мпгу,False,столовая,"город москва, несвижский переулок, дом 3",26,несвижский переулок
3841,153404,столовая при гбоу лицей 1555,False,столовая,"город москва, хилков переулок, дом 3а",45,хилков переулок
3844,152202,столовая при гбоу лицей 1535,False,столовая,"город москва, малый саввинский переулок, дом 8",105,малый саввинский переулок
3852,153436,столовая при образовательном комплексе дизайна и технологии,False,столовая,"город москва, улица савельева, дом 5",100,улица савельева
3853,153380,столовая при гбоу школа 57,False,столовая,"город москва, переулок хользунова, дом 8",48,переулок хользунова
3872,153406,столовая при гимназии 1529 им. а.с. грибоедова,False,столовая,"город москва, 2-й обыденский переулок, дом 9",30,2-й обыденский переулок
3875,150573,буфет на хитровке,False,кафе,"город москва, хитровский переулок, дом 3/1, строение 4",12,хитровский переулок
3891,28416,столовая при управлении судебного департамента,False,столовая,"город москва, андроньевская площадь, дом 5/9",45,андроньевская площадь
3910,151761,ред брик,False,бар,"город москва, хохловский переулок, дом 10, строение 6",50,хохловский переулок
3954,28810,столовая при шк. 2093 (783),False,столовая,"город москва, союзный проспект, дом 2",240,союзный проспект
3975,28809,столовая при шк. 2072,False,столовая,"город москва, утренняя улица, дом 12",200,утренняя улица
3994,28806,столовая при шк. 2093 (787),False,столовая,"город москва, улица алексея дикого, дом 18а",150,улица алексея дикого
4134,29155,школа 2104,False,столовая,"город москва, 1-й котельнический переулок, дом 5, строение 2",35,1-й котельнический переулок
4156,21583,школа №1272,False,столовая,"город москва, 1-й кожуховский проезд, дом 17",120,1-й кожуховский проезд
4157,28996,школа 574 кдп,False,столовая,"город москва, высокая улица, дом 6",210,высокая улица
4171,147916,донер бистро,False,фаст-фуд,"город москва, гончарная набережная, дом 9/16, строение 3",0,гончарная набережная
4176,150827,гбоу школа №498,False,столовая,"город москва, улица малые каменщики, дом 18",0,улица малые каменщики
4185,29309,школа 485,False,столовая,"город москва, 3-й кожуховский проезд, дом 3а",120,3-й кожуховский проезд
4197,82524,столовая мгпу,False,столовая,"город москва, 2-й сельскохозяйственный проезд, дом 4, строение 1",150,2-й сельскохозяйственный проезд
4199,28270,цсо,False,столовая,"город москва, магаданская улица, дом 9",40,магаданская улица
4208,28706,столовая (гбоу «школа №1558имени росалии де кастро»),False,столовая,"город москва, печорская улица, дом 18",300,печорская улица
4209,27468,столовая-доготовочная при школе 1099,False,столовая,"город москва, улица ротерта, дом 5",300,улица ротерта
4214,27438,школа 529,False,столовая,"город москва, 2-я напрудная улица, дом 17",240,2-я напрудная улица
4217,28705,столовая (гбоу «школа № 281»),False,столовая,"город москва, радужная улица, дом 7",240,радужная улица
4219,28701,столовая (гбоу «школа №1095»),False,столовая,"город москва, олонецкий проезд, дом 6",240,олонецкий проезд
4220,28697,столовая (гбоу «школа №281»),False,буфет,"город москва, улица рудневой, дом 10",60,улица рудневой
4222,27461,столовая-доготовочная при школе 1374,False,столовая,"город москва, федоскинская улица, дом 4",240,федоскинская улица
4226,27437,школа 762,False,столовая,"город москва, норильская улица, дом 4",300,норильская улица
4239,23022,светлана,False,кафе,"город москва, таежная улица, дом 1",45,таежная улица
4246,27441,школа 1188,False,столовая,"город москва, 1-я напрудная улица, дом 13",300,1-я напрудная улица
4278,28691,столовая при московском коледже железнодорожного транспорта,False,столовая,"город москва, кучин переулок, дом 14, строение 1",134,кучин переулок
4320,29521,столовая «потенциал»,False,столовая,"город москва, кулаков переулок, дом 7",150,кулаков переулок
4324,138024,столовая при школе № 2107,False,буфет,"город москва, напрудный переулок, дом 13",30,напрудный переулок
4326,21069,буфет при ржевской бане,False,буфет,"город москва, банный проезд, дом 3, строение 1",4,банный проезд
4338,138027,столовая при школе № 2107,False,буфет,"город москва, переулок васнецова, дом 2",43,переулок васнецова
4346,21388,буфет-раздаточный при школе № 242,False,буфет,"город москва, 1-й проезд марьиной рощи, дом 3а",50,1-й проезд марьиной рощи
4347,28629,столовая при школе № 1297,False,буфет,"город москва, малая переяславская улица, дом 6/8",83,малая переяславская улица
4354,27416,столовая при гбоу школа № 1539,False,столовая,"город москва, староалексеевская улица, дом 1",200,староалексеевская улица
4356,138014,столовая при школе № 2107,False,буфет,"город москва, больничный переулок, дом 4",34,больничный переулок
4357,28628,столовая при школе №1297,False,столовая,"город москва, глинистый переулок, дом 7, строение 1",140,глинистый переулок
4367,19744,столовая,False,столовая,"город москва, 3-я черепковская улица, дом 15а, строение 5",244,3-я черепковская улица
4406,23760,столовая гбоу города москвы № 587,False,столовая,"город москва, улица красных зорь, дом 61",110,улица красных зорь
4408,23738,столовая гбпоу зкно,False,столовая,"город москва, улица ращупкина, дом 3",180,улица ращупкина
4409,23750,столовая гбоу города москвы № 1400,False,столовая,"город москва, улица кубинка, дом 20, корпус 1",200,улица кубинка
4410,23728,столовая гбоу города москвы № 1400,False,столовая,"город москва, улица кутузова, дом 20",120,улица кутузова
4411,23638,столовая гбпоу зкно,False,буфет,"город москва, гродненская улица, дом 5",150,гродненская улица
4426,23749,столовая гбоу города москвы № 391,False,буфет,"город москва, гжатская улица, дом 6",90,гжатская улица
4429,23740,столовая гбоу города москвы № 1195,False,буфет,"город москва, вяземская улица, дом 7",100,вяземская улица
4435,23611,буфет - гбоу сош №6,False,буфет,"город москва, улица екатерины будановой, дом 18",60,улица екатерины будановой
4459,20755,останкино,False,закусочная,"город москва, троилинский переулок, дом 3",25,троилинский переулок
4474,128035,бабель,False,ресторан,"город москва, 1-й николощеповский переулок, дом 6, строение 2",140,1-й николощеповский переулок
4475,78275,ля марэ,False,ресторан,"город москва, проточный переулок, дом 7",150,проточный переулок
4541,23625,буфет-раздаточная № 731,False,буфет,"город москва, новорублевская улица, дом 1",80,новорублевская улица
4574,29285,школа 913,False,буфет,"город москва, улица степана шутова, дом 8, корпус 3",120,улица степана шутова
4576,28931,школа № 439 ителлект,False,столовая,"город москва, орехово-зуевский проезд, дом 4",40,орехово-зуевский проезд
4579,28085,столовая гну виэсх,False,столовая,"город москва, 1-й вешняковский проезд, дом 2, строение 1",20,1-й вешняковский проезд
4584,27020,palacio,False,ресторан,"город москва, улица паперника, дом 9",30,улица паперника
4588,28075,столовая спец.база атп-3 мосводоканал,False,столовая,"город москва, шоссе фрезер, дом 32, строение 1",10,шоссе фрезер
4596,28888,столовая уоо цсбофнпр,False,буфет,"город москва, тихая улица, дом 30",120,тихая улица
4633,28884,школа 335,False,буфет,"город москва, спортивный проезд, дом 3а",190,спортивный проезд
4650,28877,школа 338,False,буфет,"город москва, мариупольская улица, дом 3",250,мариупольская улица
4652,27525,гп шбс «люблино» шк. 654ст,False,столовая,"город москва, улица артюхиной, дом 17",220,улица артюхиной
4656,28920,столовая при гоу сош № 495,False,столовая,"город москва, подольская улица, дом 15",160,подольская улица
4660,28935,филиал шбс люблино шк. 493,False,столовая,"город москва, 1-й курьяновский проезд, дом 14",224,1-й курьяновский проезд
4676,27529,коникс-школьник школа 1403,False,столовая,"город москва, 1-й саратовский проезд, дом 5",89,1-й саратовский проезд
4700,26758,стумари,False,кафе,"город москва, тессинский переулок, дом 4, строение 2",55,тессинский переулок
4715,29172,пу 33,False,столовая,"город москва, тетеринский переулок, дом 2а",100,тетеринский переулок
4718,21177,школа 1468,False,буфет,"город москва, библиотечная улица, дом 29",33,библиотечная улица
4721,20999,моск. гос. авиац.-технологич. университет,False,буфет,"город москва, берниковская набережная, дом 12, строение 1",32,берниковская набережная
4725,28205,центральный дом адвоката,False,столовая,"город москва, малый полуярославский переулок, дом 3/5, строение 1",62,малый полуярославский переулок
4729,150839,лицей №1581,False,столовая,"город москва, большой полуярославский переулок, дом 7",55,большой полуярославский переулок
4736,150823,гбоу школа №480 им.в.в. талалихина,False,столовая,"город москва, стройковская улица, дом 5",0,стройковская улица
4802,21338,8-ой троллейбусный парк,False,буфет,"город москва, улица инессы арманд, дом 13",31,улица инессы арманд
4805,29450,гоу сош № 1174,False,столовая,"город москва, феодосийская улица, дом 11а",157,феодосийская улица
4817,97083,пекарня,False,кулинария,"город москва, 1-й кирпичный переулок, дом 4, строение 2",10,1-й кирпичный переулок
4832,21936,кафе гермес,False,кафе,"город москва, учинская улица, дом 10",85,учинская улица
4839,28255,марма,False,столовая,"город москва, нарвская улица, дом 2",45,нарвская улица
4860,28699,столовая (гбоу «школа №1558 имени росалии де кастро»),False,столовая,"город москва, чукотский проезд, дом 6",260,чукотский проезд
4882,27787,столовая,False,ресторан,"город москва, кремлевская набережная, дом 1, строение 2",56,кремлевская набережная
4891,27812,столовая при мз электропривод,False,столовая,"город москва, улица уткина, дом 48",20,улица уткина
4894,19965,райский уголок,False,кафе,"город москва, боровский проезд, дом 17а",96,боровский проезд
4895,19746,вэрон,False,столовая,"город москва, улица академика павлова, дом 25",80,улица академика павлова
4896,27926,столовая,False,столовая,"город москва, проезд черепановых, дом 6, строение 1",50,проезд черепановых
4924,22345,bodrum,False,кафе,"город москва, улица новая дорога, дом 11, строение 6",60,улица новая дорога
